"Story","Title","Result","Date","Stability","Duration (s)"
"Product","GET As admin I have be able to get all product","SUCCESS","2023-05-12T16:40:42.4105929+07:00[Asia/Bangkok]","0.0","0.14"
"Product","GET api endpoints for products by ID","SUCCESS","2023-05-12T16:40:42.5617222+07:00[Asia/Bangkok]","0.0","0.11"
"Product","DELETE api endpoints","SUCCESS","2023-05-12T16:40:42.6813245+07:00[Asia/Bangkok]","0.0","0.08"
"Product","POST endpoints for create new products","SUCCESS","2023-05-12T16:40:42.7648962+07:00[Asia/Bangkok]","0.0","0.09"
"Product","GET api endpoints for products ratings","SUCCESS","2023-05-12T16:40:42.8609786+07:00[Asia/Bangkok]","0.0","0.08"
"Product","GET api endpoints for products comments","SUCCESS","2023-05-12T16:40:42.94355+07:00[Asia/Bangkok]","0.0","0.07"
"Product","POST api endpoints for assign a product ratings","SUCCESS","2023-05-12T16:40:43.0201158+07:00[Asia/Bangkok]","0.0","0.09"
"Product","POST api endpoints for create comment for products","SUCCESS","2023-05-12T16:40:43.1097094+07:00[Asia/Bangkok]","0.0","0.08"
